{
  "schema_version": "fightbox.asset-descriptor.v1",
  "asset_id": "wave17-gamma0-transport-1km",
  "kind": "wav",
  "generator": {
    "wav": {
      "path": "fixtures/assets/wave17-audition/wave17-gamma0-transport-1km.wav",
      "sha256": "5f44eb8d93dd08b5d7239c42078a29cc90c7decfa3e37508cb34a99c7a7d5a52",
      "start_frame": 0,
      "loop": true
    }
  },
  "channels": 1,
  "sample_rate_hz": 48000,
  "duration_s": 8.0,
  "target_rms_dbfs": -32.852676,
  "expected_reference_rms_dbfs": -97.626131,
  "calibration": {
    "applied_gain_db": 64.773455
  },
  "non_claims": [
    "This descriptor makes no delivered-ear-SPL claim without output calibration.",
    "Audition adaptation of exact gamma0 source SHA-256 93e81e6c61d5c03863206d0c218b9a9f04330132b48810a4725347fddab07a68; the original retained artifact remains evidence authority.",
    "Stereo inputs are equal-power folded to mono and may be peak-safety attenuated/padded; this derivative is not a replacement canonical gamma stem.",
    "The looping Workbench copy is private preparation for explicit human listening and is not itself a listening judgment."
  ]
}
