{
  "schema_version": "fightbox.asset-descriptor.v1",
  "asset_id": "squad-thunder-distant-15",
  "kind": "wav",
  "generator": {
    "wav": {
      "path": "fixtures/assets/squad/squad-thunder-distant-15.wav",
      "sha256": "afb2f4b9e3f4fb5ff6dcde55965ce3c7a1c82977efb0c13e9102a5d8b1887080",
      "start_frame": 0,
      "loop": false
    }
  },
  "channels": 1,
  "sample_rate_hz": 48000,
  "duration_s": 37.64825,
  "target_rms_dbfs": -27.130486,
  "expected_reference_rms_dbfs": -23.94769,
  "calibration": {
    "applied_gain_db": -3.182796
  },
  "non_claims": [
    "This descriptor makes no delivered-ear-SPL claim without output calibration.",
    "The recording hash establishes file identity, not authorship, licensing, or provenance beyond the pinned bytes.",
    "The prepared WAV is a local derivative of a Squad v8.1 game asset; this descriptor grants no right to redistribute audio bytes.",
    "Original Squad-relative source Game/Audio/Ambient/Rain/Thunder/Distant/thunder_distant_15.ogg has SHA-256 7208d67cab7edb96401f3b245e56cbc12d602f930e2df317c2f746ca2a06c870; this records identity only and grants no rights."
  ]
}
