{
  "schema_version": "fightbox.asset-descriptor.v1",
  "asset_id": "squad-abrams-idle",
  "kind": "wav",
  "generator": {
    "wav": {
      "path": "fixtures/assets/squad/squad-abrams-idle.wav",
      "sha256": "0bf786a97f1f220163850b5ca91f3f6307fc14dc08420ed8392c0b8273829b8e",
      "start_frame": 0,
      "loop": true
    }
  },
  "channels": 1,
  "sample_rate_hz": 48000,
  "duration_s": 17.616666667,
  "target_rms_dbfs": -20.0,
  "expected_reference_rms_dbfs": -24.496803,
  "calibration": {
    "applied_gain_db": 4.496803
  },
  "non_claims": [
    "This descriptor makes no delivered-ear-SPL claim without output calibration.",
    "The recording hash establishes file identity, not authorship, licensing, or provenance beyond the pinned bytes.",
    "The prepared WAV is a local derivative of a Squad v8.1 game asset; this descriptor grants no right to redistribute audio bytes."
  ]
}
