{
  "schema_version": "fightbox.asset-descriptor.v1",
  "asset_id": "wave17-gamma9-combined-once",
  "kind": "wav",
  "generator": {
    "wav": {
      "path": "fixtures/assets/wave17-audition/wave17-gamma9-combined-once.wav",
      "sha256": "b8bf35ce40ba5a6d91b281fbdac1364a332d44ad562d0c506545f8e9299239d2",
      "start_frame": 0,
      "loop": true
    }
  },
  "channels": 1,
  "sample_rate_hz": 48000,
  "duration_s": 6.0,
  "target_rms_dbfs": -24.0,
  "expected_reference_rms_dbfs": -35.817812,
  "calibration": {
    "applied_gain_db": 11.817812
  },
  "non_claims": [
    "This descriptor makes no delivered-ear-SPL claim without output calibration.",
    "Audition adaptation of exact gamma9 source SHA-256 4ddbfa459b3e469281b0d3911388e457fe07319e85d6dd791a9787fea0093f37; the original retained artifact remains evidence authority.",
    "Stereo inputs are equal-power folded to mono and may be peak-safety attenuated/padded; this derivative is not a replacement canonical gamma stem.",
    "The looping Workbench copy is private preparation for explicit human listening and is not itself a listening judgment."
  ]
}
