{
  "schema_version": "fightbox.asset-descriptor.v1",
  "asset_id": "astra-artillery-single",
  "kind": "wav",
  "generator": {
    "wav": {
      "path": "fixtures/assets/music/artillery-impact-48k-mono.wav",
      "sha256": "1376d8461ac1f30398a2184f6c3bb7da0c64085861707be9e2f2893313560f9b",
      "start_frame": 0,
      "loop": false
    }
  },
  "channels": 1,
  "sample_rate_hz": 48000,
  "duration_s": 12.0,
  "target_rms_dbfs": -20.5,
  "expected_reference_rms_dbfs": null,
  "calibration": {
    "applied_gain_db": null
  },
  "non_claims": [
    "This descriptor makes no delivered-ear-SPL claim without output calibration.",
    "The recording hash establishes file identity, not authorship, licensing, or provenance beyond the pinned bytes.",
    "The source recording is a ~6 s impact padded with silence to a 12 s loop; the loop period is a fixture convenience, not a ballistic claim.",
    "Diagnostic finite-shot alias: same verified WAV and normalization as artillery-impact, but plays all 12 seconds once per enable instead of using the Workbench asset-ID-specific 3-second retrigger. No media is copied.",
    "The single onset at 0 s marks the shot for a fixture that declares the source impulsive; it adds no discrete echo to fixtures that keep impulsive false."
  ],
  "onsets_s": [
    0.0
  ]
}
